[
  {
    "schema_version": 1,
    "operation_id": "update-fixture",
    "installation_id": "installation-fixture",
    "host_id": "host-fixture",
    "component": "verdictan-cli",
    "target_release_id": "aaaaaaaaaaaaaaaaaaaaaaaaaaaaaaaaaaaaaaaaaaaaaaaaaaaaaaaaaaaaaaaa",
    "previous_release_id": "bbbbbbbbbbbbbbbbbbbbbbbbbbbbbbbbbbbbbbbbbbbbbbbbbbbbbbbbbbbbbbbb",
    "expected_sha256": "cccccccccccccccccccccccccccccccccccccccccccccccccccccccccccccccc",
    "generation": 1,
    "sequence": 1,
    "phase": "requested",
    "started_at": 1000,
    "updated_at": 1000,
    "bytes_completed": 0,
    "bytes_total": 10,
    "confirmed_active_release_id": null,
    "retryable": false,
    "error_code": null
  },
  {
    "schema_version": 1,
    "operation_id": "update-fixture",
    "installation_id": "installation-fixture",
    "host_id": "host-fixture",
    "component": "verdictan-cli",
    "target_release_id": "aaaaaaaaaaaaaaaaaaaaaaaaaaaaaaaaaaaaaaaaaaaaaaaaaaaaaaaaaaaaaaaa",
    "previous_release_id": "bbbbbbbbbbbbbbbbbbbbbbbbbbbbbbbbbbbbbbbbbbbbbbbbbbbbbbbbbbbbbbbb",
    "expected_sha256": "cccccccccccccccccccccccccccccccccccccccccccccccccccccccccccccccc",
    "generation": 1,
    "sequence": 2,
    "phase": "downloading",
    "started_at": 1000,
    "updated_at": 1001,
    "bytes_completed": 1,
    "bytes_total": 10,
    "confirmed_active_release_id": null,
    "retryable": false,
    "error_code": null
  },
  {
    "schema_version": 1,
    "operation_id": "update-fixture",
    "installation_id": "installation-fixture",
    "host_id": "host-fixture",
    "component": "verdictan-cli",
    "target_release_id": "aaaaaaaaaaaaaaaaaaaaaaaaaaaaaaaaaaaaaaaaaaaaaaaaaaaaaaaaaaaaaaaa",
    "previous_release_id": "bbbbbbbbbbbbbbbbbbbbbbbbbbbbbbbbbbbbbbbbbbbbbbbbbbbbbbbbbbbbbbbb",
    "expected_sha256": "cccccccccccccccccccccccccccccccccccccccccccccccccccccccccccccccc",
    "generation": 1,
    "sequence": 3,
    "phase": "verifying",
    "started_at": 1000,
    "updated_at": 1002,
    "bytes_completed": 2,
    "bytes_total": 10,
    "confirmed_active_release_id": null,
    "retryable": false,
    "error_code": null
  },
  {
    "schema_version": 1,
    "operation_id": "update-fixture",
    "installation_id": "installation-fixture",
    "host_id": "host-fixture",
    "component": "verdictan-cli",
    "target_release_id": "aaaaaaaaaaaaaaaaaaaaaaaaaaaaaaaaaaaaaaaaaaaaaaaaaaaaaaaaaaaaaaaa",
    "previous_release_id": "bbbbbbbbbbbbbbbbbbbbbbbbbbbbbbbbbbbbbbbbbbbbbbbbbbbbbbbbbbbbbbbb",
    "expected_sha256": "cccccccccccccccccccccccccccccccccccccccccccccccccccccccccccccccc",
    "generation": 1,
    "sequence": 4,
    "phase": "staged",
    "started_at": 1000,
    "updated_at": 1003,
    "bytes_completed": 3,
    "bytes_total": 10,
    "confirmed_active_release_id": null,
    "retryable": false,
    "error_code": null
  },
  {
    "schema_version": 1,
    "operation_id": "update-fixture",
    "installation_id": "installation-fixture",
    "host_id": "host-fixture",
    "component": "verdictan-cli",
    "target_release_id": "aaaaaaaaaaaaaaaaaaaaaaaaaaaaaaaaaaaaaaaaaaaaaaaaaaaaaaaaaaaaaaaa",
    "previous_release_id": "bbbbbbbbbbbbbbbbbbbbbbbbbbbbbbbbbbbbbbbbbbbbbbbbbbbbbbbbbbbbbbbb",
    "expected_sha256": "cccccccccccccccccccccccccccccccccccccccccccccccccccccccccccccccc",
    "generation": 1,
    "sequence": 5,
    "phase": "waiting-for-idle",
    "started_at": 1000,
    "updated_at": 1004,
    "bytes_completed": 4,
    "bytes_total": 10,
    "confirmed_active_release_id": null,
    "retryable": false,
    "error_code": null
  },
  {
    "schema_version": 1,
    "operation_id": "update-fixture",
    "installation_id": "installation-fixture",
    "host_id": "host-fixture",
    "component": "verdictan-cli",
    "target_release_id": "aaaaaaaaaaaaaaaaaaaaaaaaaaaaaaaaaaaaaaaaaaaaaaaaaaaaaaaaaaaaaaaa",
    "previous_release_id": "bbbbbbbbbbbbbbbbbbbbbbbbbbbbbbbbbbbbbbbbbbbbbbbbbbbbbbbbbbbbbbbb",
    "expected_sha256": "cccccccccccccccccccccccccccccccccccccccccccccccccccccccccccccccc",
    "generation": 1,
    "sequence": 6,
    "phase": "activating",
    "started_at": 1000,
    "updated_at": 1005,
    "bytes_completed": 5,
    "bytes_total": 10,
    "confirmed_active_release_id": null,
    "retryable": false,
    "error_code": null
  },
  {
    "schema_version": 1,
    "operation_id": "update-fixture",
    "installation_id": "installation-fixture",
    "host_id": "host-fixture",
    "component": "verdictan-cli",
    "target_release_id": "aaaaaaaaaaaaaaaaaaaaaaaaaaaaaaaaaaaaaaaaaaaaaaaaaaaaaaaaaaaaaaaa",
    "previous_release_id": "bbbbbbbbbbbbbbbbbbbbbbbbbbbbbbbbbbbbbbbbbbbbbbbbbbbbbbbbbbbbbbbb",
    "expected_sha256": "cccccccccccccccccccccccccccccccccccccccccccccccccccccccccccccccc",
    "generation": 1,
    "sequence": 7,
    "phase": "validating",
    "started_at": 1000,
    "updated_at": 1006,
    "bytes_completed": 6,
    "bytes_total": 10,
    "confirmed_active_release_id": null,
    "retryable": false,
    "error_code": null
  },
  {
    "schema_version": 1,
    "operation_id": "update-fixture",
    "installation_id": "installation-fixture",
    "host_id": "host-fixture",
    "component": "verdictan-cli",
    "target_release_id": "aaaaaaaaaaaaaaaaaaaaaaaaaaaaaaaaaaaaaaaaaaaaaaaaaaaaaaaaaaaaaaaa",
    "previous_release_id": "bbbbbbbbbbbbbbbbbbbbbbbbbbbbbbbbbbbbbbbbbbbbbbbbbbbbbbbbbbbbbbbb",
    "expected_sha256": "cccccccccccccccccccccccccccccccccccccccccccccccccccccccccccccccc",
    "generation": 1,
    "sequence": 8,
    "phase": "completed",
    "started_at": 1000,
    "updated_at": 1007,
    "bytes_completed": 7,
    "bytes_total": 10,
    "confirmed_active_release_id": "aaaaaaaaaaaaaaaaaaaaaaaaaaaaaaaaaaaaaaaaaaaaaaaaaaaaaaaaaaaaaaaa",
    "retryable": false,
    "error_code": null
  },
  {
    "schema_version": 1,
    "operation_id": "update-fixture",
    "installation_id": "installation-fixture",
    "host_id": "host-fixture",
    "component": "verdictan-cli",
    "target_release_id": "aaaaaaaaaaaaaaaaaaaaaaaaaaaaaaaaaaaaaaaaaaaaaaaaaaaaaaaaaaaaaaaa",
    "previous_release_id": "bbbbbbbbbbbbbbbbbbbbbbbbbbbbbbbbbbbbbbbbbbbbbbbbbbbbbbbbbbbbbbbb",
    "expected_sha256": "cccccccccccccccccccccccccccccccccccccccccccccccccccccccccccccccc",
    "generation": 1,
    "sequence": 9,
    "phase": "canceled",
    "started_at": 1000,
    "updated_at": 1008,
    "bytes_completed": 8,
    "bytes_total": 10,
    "confirmed_active_release_id": null,
    "retryable": false,
    "error_code": null
  },
  {
    "schema_version": 1,
    "operation_id": "update-fixture",
    "installation_id": "installation-fixture",
    "host_id": "host-fixture",
    "component": "verdictan-cli",
    "target_release_id": "aaaaaaaaaaaaaaaaaaaaaaaaaaaaaaaaaaaaaaaaaaaaaaaaaaaaaaaaaaaaaaaa",
    "previous_release_id": "bbbbbbbbbbbbbbbbbbbbbbbbbbbbbbbbbbbbbbbbbbbbbbbbbbbbbbbbbbbbbbbb",
    "expected_sha256": "cccccccccccccccccccccccccccccccccccccccccccccccccccccccccccccccc",
    "generation": 1,
    "sequence": 10,
    "phase": "failed",
    "started_at": 1000,
    "updated_at": 1009,
    "bytes_completed": 9,
    "bytes_total": 10,
    "confirmed_active_release_id": null,
    "retryable": false,
    "error_code": null
  },
  {
    "schema_version": 1,
    "operation_id": "update-fixture",
    "installation_id": "installation-fixture",
    "host_id": "host-fixture",
    "component": "verdictan-cli",
    "target_release_id": "aaaaaaaaaaaaaaaaaaaaaaaaaaaaaaaaaaaaaaaaaaaaaaaaaaaaaaaaaaaaaaaa",
    "previous_release_id": "bbbbbbbbbbbbbbbbbbbbbbbbbbbbbbbbbbbbbbbbbbbbbbbbbbbbbbbbbbbbbbbb",
    "expected_sha256": "cccccccccccccccccccccccccccccccccccccccccccccccccccccccccccccccc",
    "generation": 1,
    "sequence": 11,
    "phase": "interrupted",
    "started_at": 1000,
    "updated_at": 1010,
    "bytes_completed": 10,
    "bytes_total": 10,
    "confirmed_active_release_id": null,
    "retryable": false,
    "error_code": "release.owner_interrupted"
  },
  {
    "schema_version": 1,
    "operation_id": "update-fixture",
    "installation_id": "installation-fixture",
    "host_id": "host-fixture",
    "component": "verdictan-cli",
    "target_release_id": "aaaaaaaaaaaaaaaaaaaaaaaaaaaaaaaaaaaaaaaaaaaaaaaaaaaaaaaaaaaaaaaa",
    "previous_release_id": "bbbbbbbbbbbbbbbbbbbbbbbbbbbbbbbbbbbbbbbbbbbbbbbbbbbbbbbbbbbbbbbb",
    "expected_sha256": "cccccccccccccccccccccccccccccccccccccccccccccccccccccccccccccccc",
    "generation": 1,
    "sequence": 12,
    "phase": "unknown-outcome",
    "started_at": 1000,
    "updated_at": 1011,
    "bytes_completed": 10,
    "bytes_total": 10,
    "confirmed_active_release_id": null,
    "retryable": false,
    "error_code": "release.owner_interrupted"
  },
  {
    "schema_version": 1,
    "operation_id": "update-fixture",
    "installation_id": "installation-fixture",
    "host_id": "host-fixture",
    "component": "verdictan-cli",
    "target_release_id": "aaaaaaaaaaaaaaaaaaaaaaaaaaaaaaaaaaaaaaaaaaaaaaaaaaaaaaaaaaaaaaaa",
    "previous_release_id": "bbbbbbbbbbbbbbbbbbbbbbbbbbbbbbbbbbbbbbbbbbbbbbbbbbbbbbbbbbbbbbbb",
    "expected_sha256": "cccccccccccccccccccccccccccccccccccccccccccccccccccccccccccccccc",
    "generation": 1,
    "sequence": 13,
    "phase": "rolling-back",
    "started_at": 1000,
    "updated_at": 1012,
    "bytes_completed": 10,
    "bytes_total": 10,
    "confirmed_active_release_id": null,
    "retryable": false,
    "error_code": null
  },
  {
    "schema_version": 1,
    "operation_id": "update-fixture",
    "installation_id": "installation-fixture",
    "host_id": "host-fixture",
    "component": "verdictan-cli",
    "target_release_id": "aaaaaaaaaaaaaaaaaaaaaaaaaaaaaaaaaaaaaaaaaaaaaaaaaaaaaaaaaaaaaaaa",
    "previous_release_id": "bbbbbbbbbbbbbbbbbbbbbbbbbbbbbbbbbbbbbbbbbbbbbbbbbbbbbbbbbbbbbbbb",
    "expected_sha256": "cccccccccccccccccccccccccccccccccccccccccccccccccccccccccccccccc",
    "generation": 1,
    "sequence": 14,
    "phase": "rolled-back",
    "started_at": 1000,
    "updated_at": 1013,